{"status":true,"request":{"path":"/sholat/jadwal/1203/2026/2"},"data":{"id":1203,"lokasi":"KAB. BEKASI","daerah":"JAWA BARAT","jadwal":[{"tanggal":"Minggu, 01/02/2026","imsak":"04:24","subuh":"04:34","terbit":"05:50","dhuha":"06:18","dzuhur":"12:08","ashar":"15:27","maghrib":"18:19","isya":"19:32","date":"2026-02-01"},{"tanggal":"Senin, 02/02/2026","imsak":"04:25","subuh":"04:35","terbit":"05:50","dhuha":"06:19","dzuhur":"12:08","ashar":"15:27","maghrib":"18:19","isya":"19:31","date":"2026-02-02"},{"tanggal":"Selasa, 03/02/2026","imsak":"04:25","subuh":"04:35","terbit":"05:51","dhuha":"06:19","dzuhur":"12:09","ashar":"15:27","maghrib":"18:19","isya":"19:31","date":"2026-02-03"},{"tanggal":"Rabu, 04/02/2026","imsak":"04:25","subuh":"04:35","terbit":"05:51","dhuha":"06:19","dzuhur":"12:09","ashar":"15:26","maghrib":"18:19","isya":"19:31","date":"2026-02-04"},{"tanggal":"Kamis, 05/02/2026","imsak":"04:26","subuh":"04:36","terbit":"05:51","dhuha":"06:19","dzuhur":"12:09","ashar":"15:26","maghrib":"18:19","isya":"19:31","date":"2026-02-05"},{"tanggal":"Jumat, 06/02/2026","imsak":"04:26","subuh":"04:36","terbit":"05:51","dhuha":"06:19","dzuhur":"12:09","ashar":"15:26","maghrib":"18:19","isya":"19:31","date":"2026-02-06"},{"tanggal":"Sabtu, 07/02/2026","imsak":"04:27","subuh":"04:37","terbit":"05:52","dhuha":"06:20","dzuhur":"12:09","ashar":"15:25","maghrib":"18:19","isya":"19:30","date":"2026-02-07"},{"tanggal":"Minggu, 08/02/2026","imsak":"04:27","subuh":"04:37","terbit":"05:52","dhuha":"06:20","dzuhur":"12:09","ashar":"15:25","maghrib":"18:19","isya":"19:30","date":"2026-02-08"},{"tanggal":"Senin, 09/02/2026","imsak":"04:27","subuh":"04:37","terbit":"05:52","dhuha":"06:20","dzuhur":"12:09","ashar":"15:25","maghrib":"18:19","isya":"19:30","date":"2026-02-09"},{"tanggal":"Selasa, 10/02/2026","imsak":"04:28","subuh":"04:38","terbit":"05:52","dhuha":"06:20","dzuhur":"12:09","ashar":"15:24","maghrib":"18:19","isya":"19:30","date":"2026-02-10"},{"tanggal":"Rabu, 11/02/2026","imsak":"04:28","subuh":"04:38","terbit":"05:52","dhuha":"06:20","dzuhur":"12:09","ashar":"15:24","maghrib":"18:18","isya":"19:29","date":"2026-02-11"},{"tanggal":"Kamis, 12/02/2026","imsak":"04:28","subuh":"04:38","terbit":"05:53","dhuha":"06:20","dzuhur":"12:09","ashar":"15:23","maghrib":"18:18","isya":"19:29","date":"2026-02-12"},{"tanggal":"Jumat, 13/02/2026","imsak":"04:28","subuh":"04:38","terbit":"05:53","dhuha":"06:20","dzuhur":"12:09","ashar":"15:22","maghrib":"18:18","isya":"19:29","date":"2026-02-13"},{"tanggal":"Sabtu, 14/02/2026","imsak":"04:29","subuh":"04:39","terbit":"05:53","dhuha":"06:21","dzuhur":"12:09","ashar":"15:22","maghrib":"18:18","isya":"19:29","date":"2026-02-14"},{"tanggal":"Minggu, 15/02/2026","imsak":"04:29","subuh":"04:39","terbit":"05:53","dhuha":"06:21","dzuhur":"12:09","ashar":"15:21","maghrib":"18:18","isya":"19:28","date":"2026-02-15"},{"tanggal":"Senin, 16/02/2026","imsak":"04:29","subuh":"04:39","terbit":"05:53","dhuha":"06:21","dzuhur":"12:09","ashar":"15:21","maghrib":"18:17","isya":"19:28","date":"2026-02-16"},{"tanggal":"Selasa, 17/02/2026","imsak":"04:29","subuh":"04:39","terbit":"05:53","dhuha":"06:21","dzuhur":"12:09","ashar":"15:20","maghrib":"18:17","isya":"19:28","date":"2026-02-17"},{"tanggal":"Rabu, 18/02/2026","imsak":"04:30","subuh":"04:40","terbit":"05:53","dhuha":"06:21","dzuhur":"12:09","ashar":"15:19","maghrib":"18:17","isya":"19:27","date":"2026-02-18"},{"tanggal":"Kamis, 19/02/2026","imsak":"04:30","subuh":"04:40","terbit":"05:53","dhuha":"06:21","dzuhur":"12:09","ashar":"15:19","maghrib":"18:17","isya":"19:27","date":"2026-02-19"},{"tanggal":"Jumat, 20/02/2026","imsak":"04:30","subuh":"04:40","terbit":"05:53","dhuha":"06:21","dzuhur":"12:09","ashar":"15:18","maghrib":"18:16","isya":"19:26","date":"2026-02-20"},{"tanggal":"Sabtu, 21/02/2026","imsak":"04:30","subuh":"04:40","terbit":"05:54","dhuha":"06:21","dzuhur":"12:08","ashar":"15:17","maghrib":"18:16","isya":"19:26","date":"2026-02-21"},{"tanggal":"Minggu, 22/02/2026","imsak":"04:30","subuh":"04:40","terbit":"05:54","dhuha":"06:21","dzuhur":"12:08","ashar":"15:16","maghrib":"18:16","isya":"19:26","date":"2026-02-22"},{"tanggal":"Senin, 23/02/2026","imsak":"04:31","subuh":"04:41","terbit":"05:54","dhuha":"06:21","dzuhur":"12:08","ashar":"15:16","maghrib":"18:16","isya":"19:25","date":"2026-02-23"},{"tanggal":"Selasa, 24/02/2026","imsak":"04:31","subuh":"04:41","terbit":"05:54","dhuha":"06:21","dzuhur":"12:08","ashar":"15:15","maghrib":"18:15","isya":"19:25","date":"2026-02-24"},{"tanggal":"Rabu, 25/02/2026","imsak":"04:31","subuh":"04:41","terbit":"05:54","dhuha":"06:21","dzuhur":"12:08","ashar":"15:14","maghrib":"18:15","isya":"19:24","date":"2026-02-25"},{"tanggal":"Kamis, 26/02/2026","imsak":"04:31","subuh":"04:41","terbit":"05:54","dhuha":"06:21","dzuhur":"12:08","ashar":"15:13","maghrib":"18:15","isya":"19:24","date":"2026-02-26"},{"tanggal":"Jumat, 27/02/2026","imsak":"04:31","subuh":"04:41","terbit":"05:54","dhuha":"06:21","dzuhur":"12:08","ashar":"15:12","maghrib":"18:14","isya":"19:24","date":"2026-02-27"},{"tanggal":"Sabtu, 28/02/2026","imsak":"04:31","subuh":"04:41","terbit":"05:54","dhuha":"06:21","dzuhur":"12:07","ashar":"15:11","maghrib":"18:14","isya":"19:23","date":"2026-02-28"}]}}