{"status":true,"request":{"path":"/sholat/jadwal/1203/2026/3"},"data":{"id":1203,"lokasi":"KAB. BEKASI","daerah":"JAWA BARAT","jadwal":[{"tanggal":"Minggu, 01/03/2026","imsak":"04:31","subuh":"04:41","terbit":"05:54","dhuha":"06:21","dzuhur":"12:07","ashar":"15:10","maghrib":"18:14","isya":"19:23","date":"2026-03-01"},{"tanggal":"Senin, 02/03/2026","imsak":"04:31","subuh":"04:41","terbit":"05:54","dhuha":"06:21","dzuhur":"12:07","ashar":"15:09","maghrib":"18:13","isya":"19:22","date":"2026-03-02"},{"tanggal":"Selasa, 03/03/2026","imsak":"04:31","subuh":"04:41","terbit":"05:54","dhuha":"06:21","dzuhur":"12:07","ashar":"15:08","maghrib":"18:13","isya":"19:22","date":"2026-03-03"},{"tanggal":"Rabu, 04/03/2026","imsak":"04:31","subuh":"04:41","terbit":"05:54","dhuha":"06:21","dzuhur":"12:07","ashar":"15:07","maghrib":"18:12","isya":"19:21","date":"2026-03-04"},{"tanggal":"Kamis, 05/03/2026","imsak":"04:31","subuh":"04:41","terbit":"05:54","dhuha":"06:21","dzuhur":"12:06","ashar":"15:07","maghrib":"18:12","isya":"19:21","date":"2026-03-05"},{"tanggal":"Jumat, 06/03/2026","imsak":"04:31","subuh":"04:41","terbit":"05:54","dhuha":"06:21","dzuhur":"12:06","ashar":"15:07","maghrib":"18:12","isya":"19:20","date":"2026-03-06"},{"tanggal":"Sabtu, 07/03/2026","imsak":"04:31","subuh":"04:41","terbit":"05:53","dhuha":"06:21","dzuhur":"12:06","ashar":"15:08","maghrib":"18:11","isya":"19:20","date":"2026-03-07"},{"tanggal":"Minggu, 08/03/2026","imsak":"04:31","subuh":"04:41","terbit":"05:53","dhuha":"06:21","dzuhur":"12:06","ashar":"15:08","maghrib":"18:11","isya":"19:20","date":"2026-03-08"},{"tanggal":"Senin, 09/03/2026","imsak":"04:31","subuh":"04:41","terbit":"05:53","dhuha":"06:21","dzuhur":"12:05","ashar":"15:09","maghrib":"18:10","isya":"19:19","date":"2026-03-09"},{"tanggal":"Selasa, 10/03/2026","imsak":"04:31","subuh":"04:41","terbit":"05:53","dhuha":"06:20","dzuhur":"12:05","ashar":"15:09","maghrib":"18:10","isya":"19:19","date":"2026-03-10"},{"tanggal":"Rabu, 11/03/2026","imsak":"04:31","subuh":"04:41","terbit":"05:53","dhuha":"06:20","dzuhur":"12:05","ashar":"15:09","maghrib":"18:09","isya":"19:18","date":"2026-03-11"},{"tanggal":"Kamis, 12/03/2026","imsak":"04:31","subuh":"04:41","terbit":"05:53","dhuha":"06:20","dzuhur":"12:05","ashar":"15:10","maghrib":"18:09","isya":"19:18","date":"2026-03-12"},{"tanggal":"Jumat, 13/03/2026","imsak":"04:31","subuh":"04:41","terbit":"05:53","dhuha":"06:20","dzuhur":"12:04","ashar":"15:10","maghrib":"18:09","isya":"19:17","date":"2026-03-13"},{"tanggal":"Sabtu, 14/03/2026","imsak":"04:31","subuh":"04:41","terbit":"05:53","dhuha":"06:20","dzuhur":"12:04","ashar":"15:10","maghrib":"18:08","isya":"19:17","date":"2026-03-14"},{"tanggal":"Minggu, 15/03/2026","imsak":"04:31","subuh":"04:41","terbit":"05:53","dhuha":"06:20","dzuhur":"12:04","ashar":"15:11","maghrib":"18:08","isya":"19:16","date":"2026-03-15"},{"tanggal":"Senin, 16/03/2026","imsak":"04:31","subuh":"04:41","terbit":"05:53","dhuha":"06:20","dzuhur":"12:03","ashar":"15:11","maghrib":"18:07","isya":"19:16","date":"2026-03-16"},{"tanggal":"Selasa, 17/03/2026","imsak":"04:31","subuh":"04:41","terbit":"05:53","dhuha":"06:20","dzuhur":"12:03","ashar":"15:11","maghrib":"18:07","isya":"19:15","date":"2026-03-17"},{"tanggal":"Rabu, 18/03/2026","imsak":"04:31","subuh":"04:41","terbit":"05:52","dhuha":"06:20","dzuhur":"12:03","ashar":"15:11","maghrib":"18:06","isya":"19:15","date":"2026-03-18"},{"tanggal":"Kamis, 19/03/2026","imsak":"04:31","subuh":"04:41","terbit":"05:52","dhuha":"06:20","dzuhur":"12:03","ashar":"15:12","maghrib":"18:06","isya":"19:14","date":"2026-03-19"},{"tanggal":"Jumat, 20/03/2026","imsak":"04:31","subuh":"04:41","terbit":"05:52","dhuha":"06:19","dzuhur":"12:02","ashar":"15:12","maghrib":"18:05","isya":"19:14","date":"2026-03-20"},{"tanggal":"Sabtu, 21/03/2026","imsak":"04:31","subuh":"04:41","terbit":"05:52","dhuha":"06:19","dzuhur":"12:02","ashar":"15:12","maghrib":"18:05","isya":"19:14","date":"2026-03-21"},{"tanggal":"Minggu, 22/03/2026","imsak":"04:31","subuh":"04:41","terbit":"05:52","dhuha":"06:19","dzuhur":"12:02","ashar":"15:13","maghrib":"18:05","isya":"19:13","date":"2026-03-22"},{"tanggal":"Senin, 23/03/2026","imsak":"04:30","subuh":"04:40","terbit":"05:52","dhuha":"06:19","dzuhur":"12:01","ashar":"15:12","maghrib":"18:04","isya":"19:12","date":"2026-03-23"},{"tanggal":"Selasa, 24/03/2026","imsak":"04:30","subuh":"04:40","terbit":"05:52","dhuha":"06:19","dzuhur":"12:01","ashar":"15:12","maghrib":"18:03","isya":"19:12","date":"2026-03-24"},{"tanggal":"Rabu, 25/03/2026","imsak":"04:30","subuh":"04:40","terbit":"05:52","dhuha":"06:19","dzuhur":"12:01","ashar":"15:13","maghrib":"18:03","isya":"19:11","date":"2026-03-25"},{"tanggal":"Kamis, 26/03/2026","imsak":"04:30","subuh":"04:40","terbit":"05:52","dhuha":"06:19","dzuhur":"12:01","ashar":"15:13","maghrib":"18:02","isya":"19:11","date":"2026-03-26"},{"tanggal":"Jumat, 27/03/2026","imsak":"04:30","subuh":"04:40","terbit":"05:51","dhuha":"06:19","dzuhur":"12:00","ashar":"15:13","maghrib":"18:02","isya":"19:10","date":"2026-03-27"},{"tanggal":"Sabtu, 28/03/2026","imsak":"04:30","subuh":"04:40","terbit":"05:51","dhuha":"06:18","dzuhur":"12:00","ashar":"15:13","maghrib":"18:02","isya":"19:10","date":"2026-03-28"},{"tanggal":"Minggu, 29/03/2026","imsak":"04:30","subuh":"04:40","terbit":"05:51","dhuha":"06:18","dzuhur":"12:00","ashar":"15:13","maghrib":"18:01","isya":"19:10","date":"2026-03-29"},{"tanggal":"Senin, 30/03/2026","imsak":"04:29","subuh":"04:39","terbit":"05:51","dhuha":"06:18","dzuhur":"11:59","ashar":"15:13","maghrib":"18:01","isya":"19:09","date":"2026-03-30"},{"tanggal":"Selasa, 31/03/2026","imsak":"04:29","subuh":"04:39","terbit":"05:51","dhuha":"06:18","dzuhur":"11:59","ashar":"15:13","maghrib":"18:00","isya":"19:09","date":"2026-03-31"}]}}